{
  "$schema": "https://json-schema.org/draft/2020-12/schema",
  "$id": "https://commitwork.online/schema/tools.schema.json",
  "title": "Security tool registry (manifests/security-tools.json)",
  "description": "The tool registry bin/audit.mjs runs. The schema is derived from the registry's entries rather than from an intention about them: every field below is REQUIRED because every entry carries it, and `isolation` is the sole optional key. Adding a genuinely optional field is a deliberate edit here.",
  "type": "object",
  "required": ["tools"],
  "additionalProperties": false,
  "properties": {
    "$schema": { "type": "string" },
    "title": { "type": "string" },
    "note": { "type": "string" },
    "gates": {
      "type": "object",
      "description": "gate id -> human description of the precondition it names. A tool's `gate` must resolve here; an unresolvable gate is a tool that can never run and never says why.",
      "additionalProperties": { "type": "string" }
    },
    "tools": {
      "type": "array",
      "minItems": 1,
      "items": {
        "type": "object",
        "additionalProperties": false,
        "required": ["id", "name", "category", "phase", "milestone", "gate", "rationale",
          "installed", "install", "run", "report", "dependsOn"],
        "properties": {
          "id": {
            "type": "string",
            "pattern": "^[a-z0-9][a-z0-9-]*$",
            "description": "Stable identifier. Reaches the filesystem and the report tree, so it is constrained at the source rather than sanitised downstream."
          },
          "name": { "type": "string", "minLength": 1 },
          "category": { "type": "string", "minLength": 1 },
          "phase": { "type": "string" },
          "milestone": { "type": "string" },
          "gate": {
            "type": "string",
            "minLength": 1,
            "description": "The precondition this tool needs. May be a compound (`openapi+running-app`); each component must appear in `gates`."
          },
          "rationale": {
            "type": "string",
            "minLength": 20,
            "description": "WHY this tool and not the adjacent one. A registry of tools without rationales becomes a list nobody can prune, because no entry says what would make it redundant."
          },
          "installed": { "type": "string", "minLength": 1, "description": "Shell predicate: exit 0 when present." },
          "install": { "type": "string", "minLength": 1 },
          "run": { "type": "string", "minLength": 1 },
          "report": {
            "type": "string",
            "minLength": 1,
            "description": "Artifact the run writes. bin/audit.mjs records `noscan` when this is missing or unparseable — never 'ran, no findings'."
          },
          "dependsOn": {
            "type": "array",
            "items": { "type": "string" },
            "description": "Other tool ids. Topo-sorted into the remediation DAG; a cycle or an unknown id is a registry defect, not a runtime one."
          },
          "isolation": { "type": "string", "description": "Optional. Present on 2 of 13 at time of writing." }
        }
      }
    }
  }
}
